{
  "$schema": "../../../../schemas/module.schema.json",
  "id": "base",
  "type": "project-control",
  "name": "Base Controls",
  "description": "Baseline quality and verification standards for all projects",
  "version": "1.0.0",
  "provides": {
    "rules": [
      "90-ctrl-base.mdc"
    ],
    "commands": [
      "ctrl.base.check.md"
    ],
    "skills": [
      "project-basics"
    ],
    "agents": [
      "ctrl.base-verifier.md"
    ]
  },
  "requires": [""],
  "compatibility": {
    "cursor": ">=0.40.0",
    "modules": {
      "": "*"
    }
  },
  "tags": ["controls", "quality", "verification", "baseline"],
  "author": "The Hive Group",
  "license": "MIT"
}
