{
  "$schema": "../../../../../schemas/module.schema.json",
  "id": "cloud/aws",
  "type": "stack-authority",
  "name": "AWS",
  "description": "AWS deployment patterns with infrastructure as code and security best practices",
  "version": "1.0.0",
  "provides": {
    "rules": [
      "50-cloud-aws.mdc"
    ],
    "commands": [
      "cloud.aws.deploy.md",
      "cloud.aws.preflight.md"
    ],
    "skills": [
      "aws-infra-standards"
    ],
    "agents": [
      "cloud.aws-release-manager.md"
    ]
  },
  "requires": [""],
  "compatibility": {
    "cursor": ">=0.40.0",
    "modules": {
      "": "*",
      "frontend/react-tailwind": "*",
      "frontend/next-tailwind": "*",
      "frontend/angular-tailwind": "*",
      "backend/node-fastify": "*",
      "backend/java": "*",
      "database/postgres": "*",
      "database/sqlserver": "*"
    }
  },
  "tags": ["cloud", "aws", "deployment", "infrastructure", "iac", "terraform"],
  "author": "The Hive Group",
  "license": "MIT"
}
