{
  "$schema": "../../../../../schemas/module.schema.json",
  "id": "cloud/gcp",
  "type": "stack-authority",
  "name": "GCP",
  "description": "Google Cloud Platform deployment patterns with infrastructure as code",
  "version": "1.0.0",
  "provides": {
    "rules": [
      "51-cloud-gcp.mdc"
    ],
    "commands": [
      "cloud.gcp.deploy.md",
      "cloud.gcp.preflight.md"
    ],
    "skills": [
      "gcp-infra-standards"
    ],
    "agents": [
      "cloud.gcp-release-manager.md"
    ]
  },
  "requires": [""],
  "compatibility": {
    "cursor": ">=0.40.0",
    "modules": {
      "": "*",
      "frontend/react-tailwind": "*",
      "frontend/next-tailwind": "*",
      "frontend/angular-tailwind": "*",
      "backend/node-fastify": "*",
      "backend/java": "*",
      "database/postgres": "*",
      "database/sqlserver": "*"
    }
  },
  "tags": ["cloud", "gcp", "google-cloud", "deployment", "infrastructure", "iac"],
  "author": "The Hive Group",
  "license": "MIT"
}
